{
  "prompt_id": "CC-NURSERY-V3-P019",
  "version": "3.1.0",
  "page_data": {
    "page_id": "CC-NURSERY-V3-P019",
    "book_id": "COMMUNICATION_CHAMPIONS_NURSERY",
    "unit_id": "MODULE_2_MY_WORLD",
    "page_number": 19,
    "page_type": "worksheet",
    "title": "Colours Around Me",
    "age_level": "Nursery (3+)",
    "learning_objective": "Recognize and name basic colors.",
    "competencies": [
      "future skills"
    ],
    "activity": {
      "instruction": "Find and circle one red, blue, yellow and green object in the scene, then colour four blank swatches to match.",
      "evidence": "Child identifies four basic colours and completes matching swatches."
    },
    "teacher_prompt": {
      "facilitation": "Model one colour search using the red ball, then let the child find the remaining colours.",
      "questions": [
        "What colour did you find?"
      ]
    },
    "parent_prompt": {
      "conversation": "Find one object of each target colour during a room walk.",
      "home_activity": "Find one object of each target colour during a room walk."
    },
    "illustration": {
      "scene": "Simple playroom with exactly four focal objects: red ball, blue bag, yellow cup, green plant; four blank swatches below.",
      "focal_point": "Four circle targets and four blank colour swatches.",
      "style": "Premium BCube preschool workbook illustration; clean white base; soft pastels; thick rounded outlines.",
      "negative_constraints": [
        "No generated or redrawn BCube logo; reserve the approved position for the official vector asset.",
        "No unapproved text, labels, tasks, decorative frames, empty balloons, watermarks, QR codes, or third-party marks.",
        "No unexplained blank areas; every box, line, card, balloon, frame, and open area serves a named learning action.",
        "No frightening imagery, stereotypes, shame, unsafe behaviour, inaccessible instructions, anatomy errors, cropped key elements, or developmentally excessive writing.",
        "No mockup, perspective view, page curl, device frame, hands holding the page, or multiple variants.",
        "No tiny pieces, complex cutting, multiple crafts, or one prescribed result.",
        "Page-specific: No extra focal colours, rainbow lesson, colour mixing or labelled answer arrows."
      ]
    },
    "character_refs": [
      "STAR-MASCOT-V3"
    ],
    "overrides": [],
    "individual_specification": {
      "visible_text": "Find: red, blue, yellow, green. Circle the objects. Colour the swatches.",
      "response_space": "Four circle targets and four blank colour swatches.",
      "page_specific_prohibition": "No extra focal colours, rainbow lesson, colour mixing or labelled answer arrows."
    }
  },
  "compiled_prompt": "# BCube Production Prompt v3 — CC-NURSERY-V3-P019\n\n## 1. Release metadata\n\n- Prompt ID: CC-NURSERY-V3-P019\n- Version: 3.1.0\n- Book: Communication Champions\n- Level: Nursery (3+)\n- Module: Module 2 – My World\n- Page: 19 of 41\n- Exact title: Colours Around Me\n- Source: Communication_Champions_Gold_Individually_Rebuilt.xlsx\n- Source SHA-256: caecd24a409b4f531b6018b2076d42cc9222af2f198e7c9e5835cde0bc54bfba\n\n## 2. Production command\n\nCreate exactly one final, flat, front-facing A4 portrait page for “Colours Around Me”. Follow this deterministic package only. Produce no explanation, alternate, mockup, or additional page.\n\n## 3. Engine order and precedence\n\n1. Publishing Engine\n2. Design Engine\n3. Visual Grammar Engine\n4. Educational Engine\n5. Teaching Engine\n6. Parent Partnership Engine\n7. Illustration Engine\n8. Character Engine\n9. Quality Assurance and Prompt Compiler\n\nPrecedence: approved page instruction > approved book/level rule > global rule. Do not resolve conflicts by guessing.\n\n## 4. Publishing Engine\n\n- A4 portrait, 210 × 297 mm; 3 mm bleed; minimum 10 mm safe margin; 12 mm binding margin; 300 DPI; CMYK-safe; print-ready.\n- Use a 20–28 mm header with the exact title “Colours Around Me” centred and the official BCube logo reserved at top left.\n- Use a 10–14 mm footer with page number 19 only at bottom right.\n- Never generate or redraw the logo; apply the official vector asset during final layout.\n\n## 5. Design and Visual Grammar Engines\n\n- Page type: worksheet. Layout anchor: Rainbow plus labeled color swatches.\n- Visual/text balance: 70–80% visual and 20–30% text. Use one dominant focal point and a clear title → model → action → response eye path.\n- Blank-space rule: Use one purposeful art area. Maximum two core activities and one optional extension.\n- Clean white base, soft BCube pastel accents, thick rounded outlines, large targets, strong contrast, generous spacing, and no visual clutter.\n\n## 6. Educational Engine\n\n- Objective: Recognize and name basic colors.\n- Primary activity: Find and circle one red, blue, yellow and green object in the scene, then colour four blank swatches to match.\n- Secondary activity: Four circle targets and four blank colour swatches.\n- Observable evidence: Child identifies four basic colours and completes matching swatches.\n- Developmental response modes: pointing, gesture, one word, short phrase, colouring, tracing, drawing, matching, or adult-supported dictation.\n\n## 7. Teaching Engine\n\n- Facilitation: Model one colour search using the red ball, then let the child find the remaining colours.\n- Model once, invite participation, pause for processing, scaffold through gesture/choice/model language, and affirm effort without shame.\n- Teacher–student interaction must be visible, purposeful, inclusive, and connected to the exact learning objective.\n- Assessment evidence: Child identifies four basic colours and completes matching swatches.\n\n## 8. Parent Partnership Engine\n\n- Home connection: Find one object of each target colour during a room walk.\n- Use common household materials only; do not create a new scored task or require a device, purchase, or printing.\n\n## 9. Illustration and Character Engines\n\n- Composition: Simple playroom with exactly four focal objects: red ball, blue bag, yellow cup, green plant; four blank swatches below.\n- Show natural expressions, correct anatomy, inclusive children and families, clear turn-taking, unobstructed activity areas, and editable visible text.\n- Star uses the locked bright-yellow rounded five-point identity, expressive face, blue shoes, and small blue cape; Star demonstrates or encourages without completing the child’s answer.\n\n## 10. Locked individual page specification\n\n- Exact child action: Find and circle one red, blue, yellow and green object in the scene, then colour four blank swatches to match.\n- Exact observable evidence: Child identifies four basic colours and completes matching swatches.\n- Exact teacher move: Model one colour search using the red ball, then let the child find the remaining colours.\n- Exact teacher question: What colour did you find?\n- Exact home connection: Find one object of each target colour during a room walk.\n- Exact illustration scene: Simple playroom with exactly four focal objects: red ball, blue bag, yellow cup, green plant; four blank swatches below.\n- Exact visible text: Find: red, blue, yellow, green. Circle the objects. Colour the swatches.\n- Exact response space: Four circle targets and four blank colour swatches.\n- Page-specific prohibition: No extra focal colours, rainbow lesson, colour mixing or labelled answer arrows.\n- This section overrides any broader category template or generic instruction elsewhere in the package.\n\n## 11. Negative constraints\n\n- No generated or redrawn BCube logo; reserve the approved position for the official vector asset.\n- No unapproved text, labels, tasks, decorative frames, empty balloons, watermarks, QR codes, or third-party marks.\n- No unexplained blank areas; every box, line, card, balloon, frame, and open area serves a named learning action.\n- No frightening imagery, stereotypes, shame, unsafe behaviour, inaccessible instructions, anatomy errors, cropped key elements, or developmentally excessive writing.\n- No mockup, perspective view, page curl, device frame, hands holding the page, or multiple variants.\n- No tiny pieces, complex cutting, multiple crafts, or one prescribed result.\n\n## 12. Gold QA gate and compiler footer\n\nVerify page identity, geometry, bleed, safe zones, logo reservation, exact title, objective alignment, activity load, teacher interaction, parent extension, expected response, character continuity, inclusion, print suitability, prohibited extras, and unresolved variables. Any critical defect blocks release.\n\nCC-NURSERY-V3-P019 | v3.1.0 | page 19/41 | Gold 100/100 | critical defects 0 | GOLD CERTIFIED.\n",
  "validation": {
    "score": 100,
    "critical_defects": 0,
    "status": "Gold Certified"
  }
}
