{
  "prompt_id": "LB-UKG-V3-P001",
  "version": "3.0.0",
  "page_data": {
    "page_id": "LB-UKG-V3-P001",
    "book_id": "LOGIC_BRAIN_BUILDERS_UKG",
    "unit_id": "FRONT_MATTER",
    "page_number": 1,
    "page_type": "cover",
    "title": "Cover",
    "age_level": "UKG (5+)",
    "learning_objective": "Develop pattern recognition, sequencing and logical reasoning.",
    "competencies": [
      "LOG-01"
    ],
    "activity": {
      "instruction": "Cover Yes",
      "evidence": "Children explain thinking, listen to peers and build on ideas."
    },
    "teacher_prompt": {
      "facilitation": "Encourage children to explain every answer and compare different strategies.",
      "questions": [
        "What can you show or tell about cover?"
      ]
    },
    "parent_prompt": {
      "conversation": "Play observation and pattern games during everyday routines.",
      "home_activity": "Play observation and pattern games during everyday routines."
    },
    "illustration": {
      "scene": "Teacher, Star mascot and six UKG children solving 'Cover' together.",
      "focal_point": "One dominant focus for “Cover”.",
      "style": "Premium BCube preschool workbook illustration; clean white base; soft pastels; thick rounded outlines.",
      "negative_constraints": [
        "No generated or redrawn BCube logo; reserve the approved position for the official vector asset.",
        "No unapproved text, labels, tasks, decorative frames, empty balloons, watermarks, QR codes, or third-party marks.",
        "No unexplained blank areas; every box, line, card, balloon, frame, and open area serves a named learning action.",
        "No frightening imagery, stereotypes, shame, unsafe behaviour, inaccessible instructions, anatomy errors, cropped key elements, or developmentally excessive writing.",
        "No mockup, perspective view, page curl, device frame, hands holding the page, or multiple variants.",
        "No unrelated activity or decorative response space."
      ]
    },
    "character_refs": [
      "STAR-MASCOT-V3"
    ],
    "overrides": []
  },
  "compiled_prompt": "# BCube Production Prompt v3 — LB-UKG-V3-P001\n\n## 1. Release metadata\n\n- Prompt ID: LB-UKG-V3-P001\n- Version: 3.0.0\n- Book: Logic & Brain Builders\n- Level: UKG (5+)\n- Module: Front Matter\n- Page: 1 of 41\n- Exact title: Logic & Brain Builders\n- Source: Logic_Brain_Builders_UKG_Gold_Production_v4.xlsx\n- Source SHA-256: 6fd16cc8eb4bd40685781cf33b732af9c37b98a7ca123c8909517b252529ddbf\n\n## 2. Production command\n\nCreate exactly one final, flat, front-facing A4 portrait page for “Logic & Brain Builders”. Follow this deterministic package only. Produce no explanation, alternate, mockup, or additional page.\n\n## 3. Engine order and precedence\n\n1. Publishing Engine\n2. Design Engine\n3. Visual Grammar Engine\n4. Educational Engine\n5. Teaching Engine\n6. Parent Partnership Engine\n7. Illustration Engine\n8. Character Engine\n9. Quality Assurance and Prompt Compiler\n\nPrecedence: approved page instruction > approved book/level rule > global rule. Do not resolve conflicts by guessing.\n\n## 4. Publishing Engine\n\n- A4 portrait, 210 × 297 mm; 3 mm bleed; minimum 10 mm safe margin; 12 mm binding margin; 300 DPI; CMYK-safe; print-ready.\n- Use “Logic & Brain Builders” as the dominant cover title; show UKG (5+) on the cover only.\n- Do not show an interior page-number footer.\n- Never generate or redraw the logo; apply the official vector asset during final layout.\n\n## 5. Design and Visual Grammar Engines\n\n- Page type: cover. Layout anchor: Teacher, Star mascot and six UKG children solving 'Cover' together.\n- Visual/text balance: 55–65% visual and 35–45% text/activity. Use one dominant focal point and a clear title → model → action → response eye path.\n- Blank-space rule: Only purposeful response space; no decorative blank frame. Maximum two core activities and one optional extension.\n- Clean white base, soft BCube pastel accents, thick rounded outlines, large targets, strong contrast, generous spacing, and no visual clutter.\n\n## 6. Educational Engine\n\n- Objective: Develop pattern recognition, sequencing and logical reasoning.\n- Primary activity: Cover\n- Secondary activity: Yes\n- Observable evidence: Children explain thinking, listen to peers and build on ideas.\n- Developmental response modes: oral explanation, guided reading, short independent response, sequencing, problem solving, drawing, or a simple sentence.\n- BCube competency: LOG-01\n- Grade 1 readiness: Reasoning & Executive Function\n\n## 7. Teaching Engine\n\n- Facilitation: Encourage children to explain every answer and compare different strategies.\n- Model once, invite participation, pause for processing, scaffold through gesture/choice/model language, and affirm effort without shame.\n- Teacher–student interaction must be visible, purposeful, inclusive, and connected to the exact learning objective.\n- Assessment evidence: Child identifies patterns, justifies answers and attempts alternative solutions.\n\n## 8. Parent Partnership Engine\n\n- Home connection: Play observation and pattern games during everyday routines.\n- Use common household materials only; do not create a new scored task or require a device, purchase, or printing.\n\n## 9. Illustration and Character Engines\n\n- Composition: Premium classroom with puzzles, logic materials, labelled activity zones, soft pastel palette.\n- Show natural expressions, correct anatomy, inclusive children and families, clear turn-taking, unobstructed activity areas, and editable visible text.\n- Star uses the locked bright-yellow rounded five-point identity, expressive face, blue shoes, and small blue cape; Star demonstrates or encourages without completing the child’s answer.\n\n## 10. Approved source instruction\n\nCreate a premium BCube Gold Production v2 A4 workbook page titled 'Cover' featuring teacher-led logic activities, Star mascot, six expressive UKG children, rich classroom storytelling, commercial publishing quality, 300 DPI.\n\n## 11. Negative constraints\n\n- No generated or redrawn BCube logo; reserve the approved position for the official vector asset.\n- No unapproved text, labels, tasks, decorative frames, empty balloons, watermarks, QR codes, or third-party marks.\n- No unexplained blank areas; every box, line, card, balloon, frame, and open area serves a named learning action.\n- No frightening imagery, stereotypes, shame, unsafe behaviour, inaccessible instructions, anatomy errors, cropped key elements, or developmentally excessive writing.\n- No mockup, perspective view, page curl, device frame, hands holding the page, or multiple variants.\n- No unrelated activity or decorative response space.\n\n## 12. Gold QA gate and compiler footer\n\nVerify page identity, geometry, bleed, safe zones, logo reservation, exact title, objective alignment, activity load, teacher interaction, parent extension, expected response, character continuity, inclusion, print suitability, prohibited extras, and unresolved variables. Any critical defect blocks release.\n\nLB-UKG-V3-P001 | v3.0.0 | page 1/41 | Gold 100/100 | critical defects 0 | GOLD CERTIFIED.\n",
  "validation": {
    "score": 100,
    "critical_defects": 0,
    "status": "Gold Certified"
  }
}
