{
  "prompt_id": "FM-NURSERY-V3-P017",
  "version": "3.0.0",
  "page_data": {
    "page_id": "FM-NURSERY-V3-P017",
    "book_id": "FINE_MOTOR_FUN_NURSERY",
    "unit_id": "MODULE_2_LINES_AND_PATHS",
    "page_number": 17,
    "page_type": "worksheet",
    "title": "Trace Loops",
    "age_level": "Nursery (3+)",
    "learning_objective": "Trace large continuous loops without lifting the pencil.",
    "competencies": [
      "future skills"
    ],
    "activity": {
      "instruction": "One guided activity aligned to “Trace Loops”. One short speaking, reflection, or independent practice response.",
      "evidence": "Child demonstrates observable progress toward: Trace large continuous loops without lifting the pencil."
    },
    "teacher_prompt": {
      "facilitation": "Model the task, invite one response, pause, and affirm effort.",
      "questions": [
        "What can you show or tell about trace loops?"
      ]
    },
    "parent_prompt": {
      "conversation": "Repeat the same skill once in a familiar home routine using common materials.",
      "home_activity": "Repeat the same skill once in a familiar home routine using common materials."
    },
    "illustration": {
      "scene": "Four large loop paths",
      "focal_point": "One dominant focus for “Trace Loops”.",
      "style": "Premium BCube preschool workbook illustration; clean white base; soft pastels; thick rounded outlines.",
      "negative_constraints": [
        "No generated or redrawn BCube logo; reserve the approved position for the official vector asset.",
        "No unapproved text, labels, tasks, decorative frames, empty balloons, watermarks, QR codes, or third-party marks.",
        "No unexplained blank areas; every box, line, card, balloon, frame, and open area serves a named learning action.",
        "No frightening imagery, stereotypes, shame, unsafe behaviour, inaccessible instructions, anatomy errors, cropped key elements, or developmentally excessive writing.",
        "No mockup, perspective view, page curl, device frame, hands holding the page, or multiple variants.",
        "No unrelated activity or decorative response space."
      ]
    },
    "character_refs": [
      "STAR-MASCOT-V3"
    ],
    "overrides": []
  },
  "compiled_prompt": "# BCube Production Prompt v3 — FM-NURSERY-V3-P017\n\n## 1. Release metadata\n\n- Prompt ID: FM-NURSERY-V3-P017\n- Version: 3.0.0\n- Book: Fine Motor Fun\n- Level: Nursery (3+)\n- Module: Module 2 – Lines and Paths\n- Page: 17 of 41\n- Exact title: Trace Loops\n- Source: Fine_Motor_Fun_Gold_Complete_Teaching_Clarity_Updated.xlsx\n- Source SHA-256: 8796e4a125cb8e20b81fd704effb3c09082afbe0b825a7005123ac44851f1009\n\n## 2. Production command\n\nCreate exactly one final, flat, front-facing A4 portrait page for “Trace Loops”. Follow this deterministic package only. Produce no explanation, alternate, mockup, or additional page.\n\n## 3. Engine order and precedence\n\n1. Publishing Engine\n2. Design Engine\n3. Visual Grammar Engine\n4. Educational Engine\n5. Teaching Engine\n6. Parent Partnership Engine\n7. Illustration Engine\n8. Character Engine\n9. Quality Assurance and Prompt Compiler\n\nPrecedence: approved page instruction > approved book/level rule > global rule. Do not resolve conflicts by guessing.\n\n## 4. Publishing Engine\n\n- A4 portrait, 210 × 297 mm; 3 mm bleed; minimum 10 mm safe margin; 12 mm binding margin; 300 DPI; CMYK-safe; print-ready.\n- Use a 20–28 mm header with the exact title “Trace Loops” centred and the official BCube logo reserved at top left.\n- Use a 10–14 mm footer with page number 17 only at bottom right.\n- Never generate or redraw the logo; apply the official vector asset during final layout.\n\n## 5. Design and Visual Grammar Engines\n\n- Page type: worksheet. Layout anchor: Four large loop paths.\n- Visual/text balance: 70–80% visual and 20–30% text. Use one dominant focal point and a clear title → model → action → response eye path.\n- Blank-space rule: Only purposeful response space; no decorative blank frame. Maximum two core activities and one optional extension.\n- Clean white base, soft BCube pastel accents, thick rounded outlines, large targets, strong contrast, generous spacing, and no visual clutter.\n\n## 6. Educational Engine\n\n- Objective: Trace large continuous loops without lifting the pencil.\n- Primary activity: One guided activity aligned to “Trace Loops”.\n- Secondary activity: One short speaking, reflection, or independent practice response.\n- Observable evidence: Child demonstrates observable progress toward: Trace large continuous loops without lifting the pencil.\n- Developmental response modes: pointing, gesture, one word, short phrase, colouring, tracing, drawing, matching, or adult-supported dictation.\n\n## 7. Teaching Engine\n\n- Facilitation: Model the task, invite one response, pause, and affirm effort.\n- Model once, invite participation, pause for processing, scaffold through gesture/choice/model language, and affirm effort without shame.\n- Teacher–student interaction must be visible, purposeful, inclusive, and connected to the exact learning objective.\n- Assessment evidence: Child demonstrates observable progress toward: Trace large continuous loops without lifting the pencil.\n\n## 8. Parent Partnership Engine\n\n- Home connection: Repeat the same skill once in a familiar home routine using common materials.\n- Use common household materials only; do not create a new scored task or require a device, purchase, or printing.\n\n## 9. Illustration and Character Engines\n\n- Composition: Use exactly three wide loops per path; avoid tight spirals. Teaching clarity locked: no decorative empty balloons; show a direct action instruction and expected response format.\n- Show natural expressions, correct anatomy, inclusive children and families, clear turn-taking, unobstructed activity areas, and editable visible text.\n- Star uses the locked bright-yellow rounded five-point identity, expressive face, blue shoes, and small blue cape; Star demonstrates or encourages without completing the child’s answer.\n\n## 11. Negative constraints\n\n- No generated or redrawn BCube logo; reserve the approved position for the official vector asset.\n- No unapproved text, labels, tasks, decorative frames, empty balloons, watermarks, QR codes, or third-party marks.\n- No unexplained blank areas; every box, line, card, balloon, frame, and open area serves a named learning action.\n- No frightening imagery, stereotypes, shame, unsafe behaviour, inaccessible instructions, anatomy errors, cropped key elements, or developmentally excessive writing.\n- No mockup, perspective view, page curl, device frame, hands holding the page, or multiple variants.\n- No unrelated activity or decorative response space.\n\n## 12. Gold QA gate and compiler footer\n\nVerify page identity, geometry, bleed, safe zones, logo reservation, exact title, objective alignment, activity load, teacher interaction, parent extension, expected response, character continuity, inclusion, print suitability, prohibited extras, and unresolved variables. Any critical defect blocks release.\n\nFM-NURSERY-V3-P017 | v3.0.0 | page 17/41 | Gold 100/100 | critical defects 0 | GOLD CERTIFIED.\n",
  "validation": {
    "score": 100,
    "critical_defects": 0,
    "status": "Gold Certified"
  }
}
