{
  "prompt_id": "CC-NURSERY-V3-P008",
  "version": "3.1.0",
  "page_data": {
    "page_id": "CC-NURSERY-V3-P008",
    "book_id": "COMMUNICATION_CHAMPIONS_NURSERY",
    "unit_id": "MODULE_1_ME_MY_FAMILY",
    "page_number": 8,
    "page_type": "activity_page",
    "title": "My Feelings",
    "age_level": "Nursery (3+)",
    "learning_objective": "Identify and name five basic emotions.",
    "competencies": [
      "future skills"
    ],
    "activity": {
      "instruction": "Point to five faces—happy, sad, angry, scared and calm. Circle how you feel today and complete the sentence orally.",
      "evidence": "Child selects one emotion and says its word or I feel ____."
    },
    "teacher_prompt": {
      "facilitation": "Name each face without judging; model one feeling sentence and accept the child’s choice.",
      "questions": [
        "How do you feel today?"
      ]
    },
    "parent_prompt": {
      "conversation": "Ask How do you feel? during a calm routine and listen without correcting the feeling.",
      "home_activity": "Ask How do you feel? during a calm routine and listen without correcting the feeling."
    },
    "illustration": {
      "scene": "Five large face cards showing distinct, developmentally clear emotions; Star models calm breathing beside the choice row.",
      "focal_point": "One circle choice and one oral sentence starter.",
      "style": "Premium BCube preschool workbook illustration; clean white base; soft pastels; thick rounded outlines.",
      "negative_constraints": [
        "No generated or redrawn BCube logo; reserve the approved position for the official vector asset.",
        "No unapproved text, labels, tasks, decorative frames, empty balloons, watermarks, QR codes, or third-party marks.",
        "No unexplained blank areas; every box, line, card, balloon, frame, and open area serves a named learning action.",
        "No frightening imagery, stereotypes, shame, unsafe behaviour, inaccessible instructions, anatomy errors, cropped key elements, or developmentally excessive writing.",
        "No mockup, perspective view, page curl, device frame, hands holding the page, or multiple variants.",
        "No frightening wrong options, shame, trick questions, or unrelated tasks.",
        "Page-specific: No mixed emotion labels, frightening faces, diagnostic language or empty decorative balloon."
      ]
    },
    "character_refs": [
      "STAR-MASCOT-V3"
    ],
    "overrides": [],
    "individual_specification": {
      "visible_text": "happy; sad; angry; scared; calm; I feel ______.",
      "response_space": "One circle choice and one oral sentence starter.",
      "page_specific_prohibition": "No mixed emotion labels, frightening faces, diagnostic language or empty decorative balloon."
    }
  },
  "compiled_prompt": "# BCube Production Prompt v3 — CC-NURSERY-V3-P008\n\n## 1. Release metadata\n\n- Prompt ID: CC-NURSERY-V3-P008\n- Version: 3.1.0\n- Book: Communication Champions\n- Level: Nursery (3+)\n- Module: Module 1 – Me & My Family\n- Page: 8 of 41\n- Exact title: My Feelings\n- Source: Communication_Champions_Gold_Individually_Rebuilt.xlsx\n- Source SHA-256: caecd24a409b4f531b6018b2076d42cc9222af2f198e7c9e5835cde0bc54bfba\n\n## 2. Production command\n\nCreate exactly one final, flat, front-facing A4 portrait page for “My Feelings”. Follow this deterministic package only. Produce no explanation, alternate, mockup, or additional page.\n\n## 3. Engine order and precedence\n\n1. Publishing Engine\n2. Design Engine\n3. Visual Grammar Engine\n4. Educational Engine\n5. Teaching Engine\n6. Parent Partnership Engine\n7. Illustration Engine\n8. Character Engine\n9. Quality Assurance and Prompt Compiler\n\nPrecedence: approved page instruction > approved book/level rule > global rule. Do not resolve conflicts by guessing.\n\n## 4. Publishing Engine\n\n- A4 portrait, 210 × 297 mm; 3 mm bleed; minimum 10 mm safe margin; 12 mm binding margin; 300 DPI; CMYK-safe; print-ready.\n- Use a 20–28 mm header with the exact title “My Feelings” centred and the official BCube logo reserved at top left.\n- Use a 10–14 mm footer with page number 8 only at bottom right.\n- Never generate or redraw the logo; apply the official vector asset during final layout.\n\n## 5. Design and Visual Grammar Engines\n\n- Page type: activity_page. Layout anchor: Five emotion cards plus one response card.\n- Visual/text balance: 70–80% visual and 20–30% text. Use one dominant focal point and a clear title → model → action → response eye path.\n- Blank-space rule: Use choice circles or one sentence starter. Maximum two core activities and one optional extension.\n- Clean white base, soft BCube pastel accents, thick rounded outlines, large targets, strong contrast, generous spacing, and no visual clutter.\n\n## 6. Educational Engine\n\n- Objective: Identify and name five basic emotions.\n- Primary activity: Point to five faces—happy, sad, angry, scared and calm. Circle how you feel today and complete the sentence orally.\n- Secondary activity: One circle choice and one oral sentence starter.\n- Observable evidence: Child selects one emotion and says its word or I feel ____.\n- Developmental response modes: pointing, gesture, one word, short phrase, colouring, tracing, drawing, matching, or adult-supported dictation.\n\n## 7. Teaching Engine\n\n- Facilitation: Name each face without judging; model one feeling sentence and accept the child’s choice.\n- Model once, invite participation, pause for processing, scaffold through gesture/choice/model language, and affirm effort without shame.\n- Teacher–student interaction must be visible, purposeful, inclusive, and connected to the exact learning objective.\n- Assessment evidence: Child selects one emotion and says its word or I feel ____.\n\n## 8. Parent Partnership Engine\n\n- Home connection: Ask How do you feel? during a calm routine and listen without correcting the feeling.\n- Use common household materials only; do not create a new scored task or require a device, purchase, or printing.\n\n## 9. Illustration and Character Engines\n\n- Composition: Five large face cards showing distinct, developmentally clear emotions; Star models calm breathing beside the choice row.\n- Show natural expressions, correct anatomy, inclusive children and families, clear turn-taking, unobstructed activity areas, and editable visible text.\n- Star uses the locked bright-yellow rounded five-point identity, expressive face, blue shoes, and small blue cape; Star demonstrates or encourages without completing the child’s answer.\n\n## 10. Locked individual page specification\n\n- Exact child action: Point to five faces—happy, sad, angry, scared and calm. Circle how you feel today and complete the sentence orally.\n- Exact observable evidence: Child selects one emotion and says its word or I feel ____.\n- Exact teacher move: Name each face without judging; model one feeling sentence and accept the child’s choice.\n- Exact teacher question: How do you feel today?\n- Exact home connection: Ask How do you feel? during a calm routine and listen without correcting the feeling.\n- Exact illustration scene: Five large face cards showing distinct, developmentally clear emotions; Star models calm breathing beside the choice row.\n- Exact visible text: happy; sad; angry; scared; calm; I feel ______.\n- Exact response space: One circle choice and one oral sentence starter.\n- Page-specific prohibition: No mixed emotion labels, frightening faces, diagnostic language or empty decorative balloon.\n- This section overrides any broader category template or generic instruction elsewhere in the package.\n\n## 11. Negative constraints\n\n- No generated or redrawn BCube logo; reserve the approved position for the official vector asset.\n- No unapproved text, labels, tasks, decorative frames, empty balloons, watermarks, QR codes, or third-party marks.\n- No unexplained blank areas; every box, line, card, balloon, frame, and open area serves a named learning action.\n- No frightening imagery, stereotypes, shame, unsafe behaviour, inaccessible instructions, anatomy errors, cropped key elements, or developmentally excessive writing.\n- No mockup, perspective view, page curl, device frame, hands holding the page, or multiple variants.\n- No frightening wrong options, shame, trick questions, or unrelated tasks.\n\n## 12. Gold QA gate and compiler footer\n\nVerify page identity, geometry, bleed, safe zones, logo reservation, exact title, objective alignment, activity load, teacher interaction, parent extension, expected response, character continuity, inclusion, print suitability, prohibited extras, and unresolved variables. Any critical defect blocks release.\n\nCC-NURSERY-V3-P008 | v3.1.0 | page 8/41 | Gold 100/100 | critical defects 0 | GOLD CERTIFIED.\n",
  "validation": {
    "score": 100,
    "critical_defects": 0,
    "status": "Gold Certified"
  }
}
